{
  "metadata": {
    "title": "BoRo Studio International Market Intelligence — Top 50",
    "generated_date": "2026-09-21",
    "currency": "USD",
    "universe_size": 63,
    "international_top50_excludes_home_market": "Chile",
    "normalization": "Percentile ranks within the 63-economy candidate universe; log transform before percentile for GDP, GDP per capita, population and manufacturing value-added.",
    "score_version": "1.0",
    "score_formula": {
      "economic_strength_20": "12*P(log GDP nominal) + 8*P(log GDP per capita)",
      "technology_investment_readiness_20": "20*P(WIPO GII 2025 score or documented equivalent proxy)",
      "digitalization_opportunity_15": "15*P(P(log GDP per capita) * (1-P(digital/innovation maturity)))",
      "icp_density_proxy_20": "9*P(log implied population) + 7*P(log manufacturing value added) + 4*P(log GDP nominal)",
      "ability_to_pay_10": "10*P(log GDP per capita)",
      "gtm_ease_10": "4*language access + 3*time-zone overlap with Santiago + 3*B2B-email legal access",
      "outlook_5": "5*P(IMF real GDP growth 2026)"
    },
    "important_method_notes": [
      "Technology spending is not fabricated when country-level public data are unavailable. WIPO/S&P software spending % GDP is stored where observed but not forced into the score because coverage/modeling is uneven.",
      "The technology sub-score is therefore best read as technology investment/readiness, not literal total IT-spend dollars.",
      "ICP density is a transparent cross-country proxy; national sector/business-register anchors are preferred for market deep dives.",
      "Competition is reported as an inference and is deliberately not penalized in the score: high competition may be evidence of strong demand.",
      "GTM legal-access values are simplified scoring inputs, not legal advice. Actual campaigns require country-specific compliance review.",
      "Ireland GDP per capita is distorted upward by multinational accounting; GNI* sensitivity should be added before committing a large budget.",
      "TAM/SAM/SOM are ranges intended for market-screening, not forecasts of bookings."
    ],
    "fact_type_legend": {
      "FACT": "directly reported source datum",
      "ESTIMATE": "derived range or modeled market count",
      "PROXY": "observable surrogate for missing comparable measure",
      "INFERENCE": "analytical interpretation",
      "HYPOTHESIS": "requires commercial validation",
      "N/D": "not available/not used"
    }
  },
  "source_catalog": {
    "IMF_WEO_2026_04": {
      "title": "IMF World Economic Outlook Database — April 2026",
      "url": "https://data.imf.org/Datasets/WEO",
      "used_for": [
        "GDP nominal",
        "GDP per capita",
        "2026 real GDP growth",
        "5-year macro outlook"
      ],
      "note": "Cross-country macro vintage frozen to April 2026 for comparability; later July 2026 update is a sensitivity source."
    },
    "WIPO_GII_2025": {
      "title": "WIPO Global Innovation Index 2025",
      "url": "https://www.wipo.int/web-publications/global-innovation-index-2025/en/",
      "used_for": [
        "innovation/digital/technology-readiness proxy"
      ],
      "note": "139 economies; Taiwan is not covered and therefore uses a separate proxy."
    },
    "WIPO_SOFTWARE_2025": {
      "title": "WIPO GII indicator 6.2.3 — Software spending, % GDP (underlying year 2024; S&P Global)",
      "url": "https://www.wipo.int/gii-ranking/en/indicators/623",
      "used_for": [
        "reported software spending intensity where available"
      ],
      "note": "Indicator may be modeled when direct sales data are unavailable; not imputed for missing markets and not forced into score."
    },
    "EUROSTAT_DIGITAL_2026": {
      "title": "Eurostat — Digitalisation in Europe, 2026 edition",
      "url": "https://ec.europa.eu/eurostat/en/web/interactive-publications/digitalisation-2026",
      "used_for": [
        "EU SME digital intensity",
        "cloud",
        "AI adoption",
        "digitalization-gap validation"
      ]
    },
    "ITU_IDI_2026": {
      "title": "ITU ICT Development Index 2026",
      "url": "https://www.itu.int/itu-d/reports/statistics/idi2026/",
      "used_for": [
        "digital infrastructure validation"
      ]
    },
    "GARTNER_IT_2026": {
      "title": "Gartner worldwide IT spending forecast, 2026",
      "url": "https://www.gartner.com/en/newsroom",
      "used_for": [
        "global/regional technology-spending growth sensitivity"
      ],
      "note": "Worldwide IT spending forecast about +14.2% in 2026 in the July 2026 update; European IT about +11% in 2026 in regional outlook."
    },
    "WORLD_BANK_MVA": {
      "title": "World Bank WDI — Manufacturing, value added (current US$)",
      "url": "https://data.worldbank.org/indicator/NV.IND.MANF.CD",
      "used_for": [
        "industrial-density proxy"
      ],
      "note": "Latest available year differs by country; therefore treated as a proxy rather than a same-year exact measurement."
    },
    "US_CENSUS_CBP_2023": {
      "title": "U.S. Census County Business Patterns 2023 — NAICS 238220",
      "url": "https://data.census.gov/table/CBP2023.CB2300CBP?codeset=naics~238220",
      "used_for": [
        "U.S. HVAC/mechanical establishment anchor"
      ]
    },
    "US_BLS_HVAC_2026": {
      "title": "U.S. BLS Occupational Outlook — HVACR mechanics/installers",
      "url": "https://www.bls.gov/ooh/installation-maintenance-and-repair/heating-air-conditioning-and-refrigeration-mechanics-and-installers.htm",
      "used_for": [
        "labor demand / automation-pressure validation"
      ]
    },
    "US_BLS_INDUSTRIAL_2026": {
      "title": "U.S. BLS Occupational Outlook — industrial machinery mechanics/maintenance/millwrights",
      "url": "https://www.bls.gov/ooh/installation-maintenance-and-repair/industrial-machinery-mechanics-and-maintenance-workers-and-millwrights.htm",
      "used_for": [
        "industrial-maintenance labor demand"
      ]
    },
    "FTC_CAN_SPAM": {
      "title": "U.S. FTC — CAN-SPAM compliance guide",
      "url": "https://www.ftc.gov/business-guidance/resources/can-spam-act-compliance-guide-business",
      "used_for": [
        "U.S. B2B outbound compliance"
      ]
    },
    "UK_ICO_B2B": {
      "title": "UK ICO — Business-to-business marketing",
      "url": "https://ico.org.uk/for-organisations/direct-marketing-and-privacy-and-electronic-communications/business-to-business-marketing/",
      "used_for": [
        "UK B2B email compliance"
      ]
    },
    "CANADA_CASL": {
      "title": "Government of Canada — Getting consent to send email under CASL",
      "url": "https://ised-isde.canada.ca/site/canada-anti-spam-legislation/en/getting-consent-send-email",
      "used_for": [
        "Canada outbound compliance"
      ]
    },
    "SAUDI_CST_2026": {
      "title": "Saudi CST — ICT market / ITU IDI 2026",
      "url": "https://www.cst.gov.sa/en/media-center/news/N2026070101",
      "used_for": [
        "Saudi ICT market size and growth"
      ]
    },
    "TAIWAN_MOEA_2026": {
      "title": "Taiwan Ministry of Economic Affairs — manufacturing investment statistics",
      "url": "https://www.moea.gov.tw/",
      "used_for": [
        "Taiwan industrial investment validation"
      ]
    }
  },
  "markets": [
    {
      "country": "United States",
      "region": "North America",
      "raw": {
        "gdp_nominal_2025_usd_bn": 30770,
        "gdp_per_capita_2026_usd": 94430,
        "real_gdp_growth_2026_pct": 2.3,
        "innovation_digital_proxy_2025": 61.7,
        "manufacturing_value_added_proxy_usd_bn": 2497.1,
        "software_spending_2024_pct_gdp": 1.26,
        "language_access_0_1": 1.0,
        "timezone_overlap_0_1": 0.95,
        "b2b_email_legal_access_0_1": 1.0
      },
      "subscores": {
        "economic_strength_20": 19.355,
        "technology_investment_readiness_20": 19.355,
        "digitalization_opportunity_15": 1.694,
        "icp_density_proxy_20": 19.597,
        "ability_to_pay_10": 9.194,
        "gtm_ease_10": 9.85,
        "outlook_5": 2.863
      },
      "market_score": 81.908,
      "rank": 1,
      "market_categories": [
        "GIANT_MARKET"
      ],
      "competition": {
        "level": "VERY_HIGH",
        "fact_type": "INFERENCE",
        "included_in_score": false
      },
      "why_it_matters": "Largest addressable field-service base, highest observed software-spend intensity in the dataset, high ticket capacity and workable B2B email rules; competition is intense.",
      "confidence_level": "HIGH",
      "sources": [
        "IMF_WEO_2026_04",
        "WIPO_GII_2025",
        "WORLD_BANK_MVA",
        "WIPO_SOFTWARE_2025",
        "US_CENSUS_CBP_2023",
        "US_BLS_HVAC_2026",
        "US_BLS_INDUSTRIAL_2026",
        "FTC_CAN_SPAM"
      ],
      "technology_spending_growth": {
        "value_pct": null,
        "scope": "N/D; global IT growth benchmark is not treated as a country value",
        "fact_type": "N/D"
      },
      "tam_sam_som": {
        "fact_type": "ESTIMATE",
        "confidence_level": "HIGH_MEDIUM",
        "tam_relevant_employer_firms": {
          "min": 300000,
          "max": 500000
        },
        "sam_boro_icp_firms": {
          "min": 50000,
          "max": 90000
        },
        "som_addressable_accounts_12_24m": {
          "min": 2500,
          "max": 5000
        },
        "ticket_usd": {
          "min": 20000,
          "max": 60000
        },
        "sam_economic_value_usd": {
          "min": 1000000000,
          "max": 5400000000
        },
        "som_account_pool_value_usd": {
          "min": 50000000,
          "max": 300000000
        },
        "warning": "SOM is prospectable account pool, not expected closed revenue."
      },
      "deep_dive": {
        "priority_verticals": "Commercial HVAC/mechanical; refrigeration; industrial equipment service; facilities; electrical",